{
  "schema_version": 1,
  "pipeline_version": "v6",
  "run_id": "daily-2026-06-04-20260604034905.-b8597526",
  "date": "2026-06-04",
  "source": "github",
  "generated_at": "2026-06-04T03:49:05.396Z",
  "stats": {
    "total": 6,
    "qualified": 0,
    "pending": 6,
    "unqualified": 0,
    "passonce": 0,
    "fast_first": 6
  },
  "items": [
    {
      "canonical_id": "github:jwasham/coding-interview-university",
      "origin_ids": [
        "jwasham/coding-interview-university"
      ],
      "source": "github",
      "name": "coding-interview-university",
      "url": "https://github.com/jwasham/coding-interview-university",
      "description": "A complete computer science study plan to become a software engineer.",
      "tags": [
        "algorithm",
        "algorithms",
        "coding-interview",
        "coding-interviews",
        "computer-science",
        "data-structures",
        "interview",
        "interview-prep",
        "interview-preparation",
        "programming-interviews",
        "software-engineering",
        "study-plan"
      ],
      "summary_short": {
        "zh": "A complete computer science study plan to become a software engineer.",
        "en": "A complete computer science study plan to become a software engineer.",
        "es": ""
      },
      "summary_flags": {
        "needs_tri": true,
        "fast_first": true,
        "placeholder": true
      },
      "summary_version": 0,
      "status": "pending",
      "promptHash": "sha256:3c6ec9fbea8a96a623f2f38d74b2bd6b437e27ea550dfe100cfa566625f218a3",
      "stats": {
        "stars": 349128,
        "forks": 83168,
        "issues": 113
      },
      "metadata": {
        "license": "CC-BY-SA-4.0",
        "lang": "N/A",
        "categories": {
          "capabilities": [],
          "scenes": [],
          "lifecycle": []
        }
      },
      "created_at": "2026-06-04T03:49:05.396Z",
      "updated_at": "2026-06-04T03:49:05.396Z",
      "owner": "jwasham"
    },
    {
      "canonical_id": "github:NousResearch/hermes-agent",
      "origin_ids": [
        "NousResearch/hermes-agent"
      ],
      "source": "github",
      "name": "hermes-agent",
      "url": "https://github.com/NousResearch/hermes-agent",
      "description": "The agent that grows with you",
      "tags": [
        "ai",
        "ai-agent",
        "ai-agents",
        "anthropic",
        "chatgpt",
        "claude",
        "claude-code",
        "clawdbot",
        "codex",
        "hermes",
        "hermes-agent",
        "llm",
        "moltbot",
        "nous-research",
        "openai",
        "openclaw"
      ],
      "summary_short": {
        "zh": "The agent that grows with you",
        "en": "The agent that grows with you",
        "es": ""
      },
      "summary_flags": {
        "needs_tri": true,
        "fast_first": true,
        "placeholder": true
      },
      "summary_version": 0,
      "status": "pending",
      "promptHash": "sha256:f95b7d1ddb9785b7a50dad29e80a27fa8f4c80d8d79387bf752a0545a41d0e30",
      "stats": {
        "stars": 179437,
        "forks": 30732,
        "issues": 17337
      },
      "metadata": {
        "license": "MIT",
        "lang": "Python",
        "categories": {
          "capabilities": [],
          "scenes": [],
          "lifecycle": []
        }
      },
      "created_at": "2026-06-04T03:49:05.396Z",
      "updated_at": "2026-06-04T03:49:05.396Z",
      "owner": "NousResearch"
    },
    {
      "canonical_id": "github:microsoft/markitdown",
      "origin_ids": [
        "microsoft/markitdown"
      ],
      "source": "github",
      "name": "markitdown",
      "url": "https://github.com/microsoft/markitdown",
      "description": "Python tool for converting files and office documents to Markdown.",
      "tags": [
        "autogen",
        "autogen-extension",
        "langchain",
        "markdown",
        "microsoft-office",
        "openai",
        "pdf"
      ],
      "summary_short": {
        "zh": "Python tool for converting files and office documents to Markdown.",
        "en": "Python tool for converting files and office documents to Markdown.",
        "es": ""
      },
      "summary_flags": {
        "needs_tri": true,
        "fast_first": true,
        "placeholder": true
      },
      "summary_version": 0,
      "status": "pending",
      "promptHash": "sha256:7616999e535914efd4659f405a035ca22f9fb94114b22bea24a473a8fe2b86ac",
      "stats": {
        "stars": 143086,
        "forks": 9774,
        "issues": 803
      },
      "metadata": {
        "license": "MIT",
        "lang": "Python",
        "categories": {
          "capabilities": [],
          "scenes": [],
          "lifecycle": []
        }
      },
      "created_at": "2026-06-04T03:49:05.396Z",
      "updated_at": "2026-06-04T03:49:05.396Z",
      "owner": "microsoft"
    },
    {
      "canonical_id": "github:HKUDS/Vibe-Trading",
      "origin_ids": [
        "HKUDS/Vibe-Trading"
      ],
      "source": "github",
      "name": "Vibe-Trading",
      "url": "https://github.com/HKUDS/Vibe-Trading",
      "description": "\"Vibe-Trading: Your Personal Trading Agent\"",
      "tags": [
        "ai-agent",
        "algorithmic-trading",
        "backtesting",
        "fintech",
        "llm",
        "mcp",
        "multi-agent",
        "python",
        "quantitative-finance",
        "trading"
      ],
      "summary_short": {
        "zh": "\"Vibe-Trading: Your Personal Trading Agent\"",
        "en": "\"Vibe-Trading: Your Personal Trading Agent\"",
        "es": ""
      },
      "summary_flags": {
        "needs_tri": true,
        "fast_first": true,
        "placeholder": true
      },
      "summary_version": 0,
      "status": "pending",
      "promptHash": "sha256:51f8f233d7ea6d6d149a283307559676ded9e9bf0f84a0c1b5b0fc443bc331c9",
      "stats": {
        "stars": 10099,
        "forks": 2021,
        "issues": 7
      },
      "metadata": {
        "license": "MIT",
        "lang": "Python",
        "categories": {
          "capabilities": [],
          "scenes": [],
          "lifecycle": []
        }
      },
      "created_at": "2026-06-04T03:49:05.396Z",
      "updated_at": "2026-06-04T03:49:05.396Z",
      "owner": "HKUDS"
    },
    {
      "canonical_id": "github:codecrafters-io/build-your-own-x",
      "origin_ids": [
        "codecrafters-io/build-your-own-x"
      ],
      "source": "github",
      "name": "build-your-own-x",
      "url": "https://github.com/codecrafters-io/build-your-own-x",
      "description": "Master programming by recreating your favorite technologies from scratch.",
      "tags": [
        "awesome-list",
        "free",
        "programming",
        "tutorial-code",
        "tutorial-exercises",
        "tutorials"
      ],
      "summary_short": {
        "zh": "Master programming by recreating your favorite technologies from scratch.",
        "en": "Master programming by recreating your favorite technologies from scratch.",
        "es": ""
      },
      "summary_flags": {
        "needs_tri": true,
        "fast_first": true,
        "placeholder": true
      },
      "summary_version": 0,
      "status": "pending",
      "promptHash": "sha256:f0cc453408c52590c9c95e035339467922e740d334a51760d2024391693233ee",
      "stats": {
        "stars": 511604,
        "forks": 48502,
        "issues": 501
      },
      "metadata": {
        "license": "N/A",
        "lang": "Markdown",
        "categories": {
          "capabilities": [],
          "scenes": [],
          "lifecycle": []
        }
      },
      "created_at": "2026-06-04T03:49:05.396Z",
      "updated_at": "2026-06-04T03:49:05.396Z",
      "owner": "codecrafters-io"
    },
    {
      "canonical_id": "github:sindresorhus/awesome",
      "origin_ids": [
        "sindresorhus/awesome"
      ],
      "source": "github",
      "name": "awesome",
      "url": "https://github.com/sindresorhus/awesome",
      "description": "😎 Awesome lists about all kinds of interesting topics",
      "tags": [
        "awesome",
        "awesome-list",
        "lists",
        "resources",
        "unicorns"
      ],
      "summary_short": {
        "zh": "😎 Awesome lists about all kinds of interesting topics",
        "en": "😎 Awesome lists about all kinds of interesting topics",
        "es": ""
      },
      "summary_flags": {
        "needs_tri": true,
        "fast_first": true,
        "placeholder": true
      },
      "summary_version": 0,
      "status": "pending",
      "promptHash": "sha256:2724fb8aae725474927df4f6b45de69bae28d10fbcf1a45f9da35c228ebe25de",
      "stats": {
        "stars": 472707,
        "forks": 35297,
        "issues": 82
      },
      "metadata": {
        "license": "CC0-1.0",
        "lang": "N/A",
        "categories": {
          "capabilities": [],
          "scenes": [],
          "lifecycle": []
        }
      },
      "created_at": "2026-06-04T03:49:05.396Z",
      "updated_at": "2026-06-04T03:49:05.396Z",
      "owner": "sindresorhus"
    }
  ]
}
