{
  "schema_version": 1,
  "pipeline_version": "v6",
  "run_id": "daily-2026-05-16-20260516034826.-6853a755",
  "date": "2026-05-16",
  "source": "huggingface",
  "generated_at": "2026-05-16T03:48:26.323Z",
  "stats": {
    "total": 5,
    "qualified": 0,
    "pending": 5,
    "unqualified": 0,
    "passonce": 0,
    "fast_first": 5
  },
  "items": [
    {
      "canonical_id": "huggingface:sentence-transformers/all-MiniLM-L6-v2",
      "origin_ids": [
        "sentence-transformers/all-MiniLM-L6-v2"
      ],
      "source": "huggingface",
      "name": "all-MiniLM-L6-v2",
      "url": "https://huggingface.co/sentence-transformers/all-MiniLM-L6-v2",
      "description": "",
      "tags": [
        "sentence-transformers",
        "pytorch",
        "tf",
        "rust",
        "onnx",
        "safetensors",
        "openvino",
        "bert",
        "feature-extraction",
        "sentence-similarity",
        "transformers",
        "en",
        "dataset:s2orc",
        "dataset:flax-sentence-embeddings/stackexchange_xml",
        "dataset:ms_marco",
        "dataset:gooaq",
        "dataset:yahoo_answers_topics",
        "dataset:code_search_net",
        "dataset:search_qa",
        "dataset:eli5",
        "dataset:snli",
        "dataset:multi_nli",
        "dataset:wikihow",
        "dataset:natural_questions",
        "dataset:trivia_qa",
        "dataset:embedding-data/sentence-compression",
        "dataset:embedding-data/flickr30k-captions",
        "dataset:embedding-data/altlex",
        "dataset:embedding-data/simple-wiki",
        "dataset:embedding-data/QQP",
        "dataset:embedding-data/SPECTER",
        "dataset:embedding-data/PAQ_pairs",
        "dataset:embedding-data/WikiAnswers",
        "arxiv:1904.06472",
        "arxiv:2102.07033",
        "arxiv:2104.08727",
        "arxiv:1704.05179",
        "arxiv:1810.09305",
        "license:apache-2.0",
        "eval-results",
        "text-embeddings-inference",
        "endpoints_compatible",
        "region:us",
        "deploy:azure"
      ],
      "summary_short": {
        "zh": "",
        "en": "",
        "es": ""
      },
      "summary_flags": {
        "needs_tri": true,
        "fast_first": true,
        "placeholder": true
      },
      "summary_version": 0,
      "status": "pending",
      "promptHash": "sha256:8ca19d098c0d5ea46046da1c9f3b1a75106bb839b2c9e9dd8eef54e1c97f811a",
      "stats": {
        "downloads_total": 259858781,
        "likes_total": 4791
      },
      "metadata": {
        "license": "N/A",
        "lang": "N/A",
        "categories": {
          "capabilities": [],
          "scenes": [],
          "lifecycle": []
        }
      },
      "created_at": "2026-05-16T03:48:26.323Z",
      "updated_at": "2026-05-16T03:48:26.323Z",
      "repo_id": "sentence-transformers/all-MiniLM-L6-v2"
    },
    {
      "canonical_id": "huggingface:Qwen/Qwen3-VL-2B-Instruct",
      "origin_ids": [
        "Qwen/Qwen3-VL-2B-Instruct"
      ],
      "source": "huggingface",
      "name": "Qwen3-VL-2B-Instruct",
      "url": "https://huggingface.co/Qwen/Qwen3-VL-2B-Instruct",
      "description": "",
      "tags": [
        "transformers",
        "safetensors",
        "qwen3_vl",
        "image-text-to-text",
        "conversational",
        "arxiv:2505.09388",
        "arxiv:2502.13923",
        "arxiv:2409.12191",
        "arxiv:2308.12966",
        "license:apache-2.0",
        "eval-results",
        "endpoints_compatible",
        "deploy:azure",
        "region:us"
      ],
      "summary_short": {
        "zh": "",
        "en": "",
        "es": ""
      },
      "summary_flags": {
        "needs_tri": true,
        "fast_first": true,
        "placeholder": true
      },
      "summary_version": 0,
      "status": "pending",
      "promptHash": "sha256:032889889a590cbf5c2557d80b343dfca5c96f44bb033b0997a940ef37fd203f",
      "stats": {
        "downloads_total": 169903359,
        "likes_total": 405
      },
      "metadata": {
        "license": "N/A",
        "lang": "N/A",
        "categories": {
          "capabilities": [],
          "scenes": [],
          "lifecycle": []
        }
      },
      "created_at": "2026-05-16T03:48:26.323Z",
      "updated_at": "2026-05-16T03:48:26.323Z",
      "repo_id": "Qwen/Qwen3-VL-2B-Instruct"
    },
    {
      "canonical_id": "huggingface:google-bert/bert-base-uncased",
      "origin_ids": [
        "google-bert/bert-base-uncased"
      ],
      "source": "huggingface",
      "name": "bert-base-uncased",
      "url": "https://huggingface.co/google-bert/bert-base-uncased",
      "description": "",
      "tags": [
        "transformers",
        "pytorch",
        "tf",
        "jax",
        "rust",
        "coreml",
        "onnx",
        "safetensors",
        "bert",
        "fill-mask",
        "exbert",
        "en",
        "dataset:bookcorpus",
        "dataset:wikipedia",
        "arxiv:1810.04805",
        "license:apache-2.0",
        "endpoints_compatible",
        "region:us",
        "deploy:azure"
      ],
      "summary_short": {
        "zh": "",
        "en": "",
        "es": ""
      },
      "summary_flags": {
        "needs_tri": true,
        "fast_first": true,
        "placeholder": true
      },
      "summary_version": 0,
      "status": "pending",
      "promptHash": "sha256:103bf1cded07197c1a0c664f6dcb115c0d0822e3d00b7dfad50034a8b7a28f29",
      "stats": {
        "downloads_total": 64748512,
        "likes_total": 2652
      },
      "metadata": {
        "license": "N/A",
        "lang": "N/A",
        "categories": {
          "capabilities": [],
          "scenes": [],
          "lifecycle": []
        }
      },
      "created_at": "2026-05-16T03:48:26.323Z",
      "updated_at": "2026-05-16T03:48:26.323Z",
      "repo_id": "google-bert/bert-base-uncased"
    },
    {
      "canonical_id": "huggingface:google/electra-base-discriminator",
      "origin_ids": [
        "google/electra-base-discriminator"
      ],
      "source": "huggingface",
      "name": "electra-base-discriminator",
      "url": "https://huggingface.co/google/electra-base-discriminator",
      "description": "",
      "tags": [
        "transformers",
        "pytorch",
        "tf",
        "jax",
        "rust",
        "electra",
        "pretraining",
        "en",
        "arxiv:1406.2661",
        "license:apache-2.0",
        "endpoints_compatible",
        "region:us"
      ],
      "summary_short": {
        "zh": "",
        "en": "",
        "es": ""
      },
      "summary_flags": {
        "needs_tri": true,
        "fast_first": true,
        "placeholder": true
      },
      "summary_version": 0,
      "status": "pending",
      "promptHash": "sha256:b7a35829f521c4fdcddf87805ac9f16ebd258cc548173cdfb983730156ddf6b9",
      "stats": {
        "downloads_total": 52827548,
        "likes_total": 106
      },
      "metadata": {
        "license": "N/A",
        "lang": "N/A",
        "categories": {
          "capabilities": [],
          "scenes": [],
          "lifecycle": []
        }
      },
      "created_at": "2026-05-16T03:48:26.323Z",
      "updated_at": "2026-05-16T03:48:26.323Z",
      "repo_id": "google/electra-base-discriminator"
    },
    {
      "canonical_id": "huggingface:cross-encoder/ms-marco-MiniLM-L6-v2",
      "origin_ids": [
        "cross-encoder/ms-marco-MiniLM-L6-v2"
      ],
      "source": "huggingface",
      "name": "ms-marco-MiniLM-L6-v2",
      "url": "https://huggingface.co/cross-encoder/ms-marco-MiniLM-L6-v2",
      "description": "",
      "tags": [
        "sentence-transformers",
        "pytorch",
        "jax",
        "onnx",
        "safetensors",
        "openvino",
        "bert",
        "text-classification",
        "transformers",
        "text-ranking",
        "en",
        "dataset:sentence-transformers/msmarco",
        "base_model:cross-encoder/ms-marco-MiniLM-L12-v2",
        "base_model:quantized:cross-encoder/ms-marco-MiniLM-L12-v2",
        "license:apache-2.0",
        "text-embeddings-inference",
        "endpoints_compatible",
        "region:us"
      ],
      "summary_short": {
        "zh": "",
        "en": "",
        "es": ""
      },
      "summary_flags": {
        "needs_tri": true,
        "fast_first": true,
        "placeholder": true
      },
      "summary_version": 0,
      "status": "pending",
      "promptHash": "sha256:e870990c5b3a25ae59fcf44e1245c0641a539ed34ccc7b8fa7795cfff5731ee3",
      "stats": {
        "downloads_total": 52069538,
        "likes_total": 239
      },
      "metadata": {
        "license": "N/A",
        "lang": "N/A",
        "categories": {
          "capabilities": [],
          "scenes": [],
          "lifecycle": []
        }
      },
      "created_at": "2026-05-16T03:48:26.323Z",
      "updated_at": "2026-05-16T03:48:26.323Z",
      "repo_id": "cross-encoder/ms-marco-MiniLM-L6-v2"
    }
  ]
}
