{
  "schema_version": 1,
  "pipeline_version": "v6",
  "run_id": "daily-2026-02-02-20260202033009.-02516d89",
  "date": "2026-02-02",
  "source": "huggingface",
  "generated_at": "2026-02-02T03:30:10.021Z",
  "stats": {
    "total": 6,
    "qualified": 0,
    "pending": 6,
    "unqualified": 0,
    "passonce": 0,
    "fast_first": 6
  },
  "items": [
    {
      "canonical_id": "huggingface:sentence-transformers/all-MiniLM-L6-v2",
      "origin_ids": [
        "sentence-transformers/all-MiniLM-L6-v2"
      ],
      "source": "huggingface",
      "name": "all-MiniLM-L6-v2",
      "url": "https://huggingface.co/sentence-transformers/all-MiniLM-L6-v2",
      "description": "",
      "tags": [
        "sentence-transformers",
        "pytorch",
        "tf",
        "rust",
        "onnx",
        "safetensors",
        "openvino",
        "bert",
        "feature-extraction",
        "sentence-similarity",
        "transformers",
        "en",
        "dataset:s2orc",
        "dataset:flax-sentence-embeddings/stackexchange_xml",
        "dataset:ms_marco",
        "dataset:gooaq",
        "dataset:yahoo_answers_topics",
        "dataset:code_search_net",
        "dataset:search_qa",
        "dataset:eli5",
        "dataset:snli",
        "dataset:multi_nli",
        "dataset:wikihow",
        "dataset:natural_questions",
        "dataset:trivia_qa",
        "dataset:embedding-data/sentence-compression",
        "dataset:embedding-data/flickr30k-captions",
        "dataset:embedding-data/altlex",
        "dataset:embedding-data/simple-wiki",
        "dataset:embedding-data/QQP",
        "dataset:embedding-data/SPECTER",
        "dataset:embedding-data/PAQ_pairs",
        "dataset:embedding-data/WikiAnswers",
        "arxiv:1904.06472",
        "arxiv:2102.07033",
        "arxiv:2104.08727",
        "arxiv:1704.05179",
        "arxiv:1810.09305",
        "license:apache-2.0",
        "text-embeddings-inference",
        "endpoints_compatible",
        "deploy:azure",
        "region:us"
      ],
      "summary_short": {
        "zh": "",
        "en": "",
        "es": ""
      },
      "summary_flags": {
        "needs_tri": true,
        "fast_first": true,
        "placeholder": true
      },
      "summary_version": 0,
      "status": "pending",
      "promptHash": "sha256:8ca19d098c0d5ea46046da1c9f3b1a75106bb839b2c9e9dd8eef54e1c97f811a",
      "stats": {
        "downloads_total": 141838267,
        "likes_total": 4407
      },
      "metadata": {
        "license": "N/A",
        "lang": "N/A",
        "categories": {
          "capabilities": [],
          "scenes": [],
          "lifecycle": []
        }
      },
      "created_at": "2026-02-02T03:30:10.021Z",
      "updated_at": "2026-02-02T03:30:10.021Z",
      "repo_id": "sentence-transformers/all-MiniLM-L6-v2"
    },
    {
      "canonical_id": "huggingface:Falconsai/nsfw_image_detection",
      "origin_ids": [
        "Falconsai/nsfw_image_detection"
      ],
      "source": "huggingface",
      "name": "nsfw_image_detection",
      "url": "https://huggingface.co/Falconsai/nsfw_image_detection",
      "description": "",
      "tags": [
        "transformers",
        "pytorch",
        "safetensors",
        "vit",
        "image-classification",
        "arxiv:2010.11929",
        "license:apache-2.0",
        "endpoints_compatible",
        "deploy:azure",
        "region:us"
      ],
      "summary_short": {
        "zh": "",
        "en": "",
        "es": ""
      },
      "summary_flags": {
        "needs_tri": true,
        "fast_first": true,
        "placeholder": true
      },
      "summary_version": 0,
      "status": "pending",
      "promptHash": "sha256:99eb3455f132a5daa0b74321d39efa65c6809414abe9e770c4103364cd72c767",
      "stats": {
        "downloads_total": 66227470,
        "likes_total": 971
      },
      "metadata": {
        "license": "N/A",
        "lang": "N/A",
        "categories": {
          "capabilities": [],
          "scenes": [],
          "lifecycle": []
        }
      },
      "created_at": "2026-02-02T03:30:10.021Z",
      "updated_at": "2026-02-02T03:30:10.021Z",
      "repo_id": "Falconsai/nsfw_image_detection"
    },
    {
      "canonical_id": "huggingface:google/electra-base-discriminator",
      "origin_ids": [
        "google/electra-base-discriminator"
      ],
      "source": "huggingface",
      "name": "electra-base-discriminator",
      "url": "https://huggingface.co/google/electra-base-discriminator",
      "description": "",
      "tags": [
        "transformers",
        "pytorch",
        "tf",
        "jax",
        "rust",
        "electra",
        "pretraining",
        "en",
        "arxiv:1406.2661",
        "license:apache-2.0",
        "endpoints_compatible",
        "region:us"
      ],
      "summary_short": {
        "zh": "",
        "en": "",
        "es": ""
      },
      "summary_flags": {
        "needs_tri": true,
        "fast_first": true,
        "placeholder": true
      },
      "summary_version": 0,
      "status": "pending",
      "promptHash": "sha256:b7a35829f521c4fdcddf87805ac9f16ebd258cc548173cdfb983730156ddf6b9",
      "stats": {
        "downloads_total": 48107630,
        "likes_total": 79
      },
      "metadata": {
        "license": "N/A",
        "lang": "N/A",
        "categories": {
          "capabilities": [],
          "scenes": [],
          "lifecycle": []
        }
      },
      "created_at": "2026-02-02T03:30:10.021Z",
      "updated_at": "2026-02-02T03:30:10.021Z",
      "repo_id": "google/electra-base-discriminator"
    },
    {
      "canonical_id": "huggingface:dima806/fairface_age_image_detection",
      "origin_ids": [
        "dima806/fairface_age_image_detection"
      ],
      "source": "huggingface",
      "name": "fairface_age_image_detection",
      "url": "https://huggingface.co/dima806/fairface_age_image_detection",
      "description": "",
      "tags": [
        "transformers",
        "safetensors",
        "vit",
        "image-classification",
        "dataset:nateraw/fairface",
        "base_model:google/vit-base-patch16-224-in21k",
        "base_model:finetune:google/vit-base-patch16-224-in21k",
        "license:apache-2.0",
        "endpoints_compatible",
        "region:us"
      ],
      "summary_short": {
        "zh": "",
        "en": "",
        "es": ""
      },
      "summary_flags": {
        "needs_tri": true,
        "fast_first": true,
        "placeholder": true
      },
      "summary_version": 0,
      "status": "pending",
      "promptHash": "sha256:ec0b6409340ca5062d0bc84b162ba7095cf7c565f51f8a3a56f5458334e73fbb",
      "stats": {
        "downloads_total": 43027405,
        "likes_total": 59
      },
      "metadata": {
        "license": "N/A",
        "lang": "N/A",
        "categories": {
          "capabilities": [],
          "scenes": [],
          "lifecycle": []
        }
      },
      "created_at": "2026-02-02T03:30:10.021Z",
      "updated_at": "2026-02-02T03:30:10.021Z",
      "repo_id": "dima806/fairface_age_image_detection"
    },
    {
      "canonical_id": "huggingface:google-bert/bert-base-uncased",
      "origin_ids": [
        "google-bert/bert-base-uncased"
      ],
      "source": "huggingface",
      "name": "bert-base-uncased",
      "url": "https://huggingface.co/google-bert/bert-base-uncased",
      "description": "",
      "tags": [
        "transformers",
        "pytorch",
        "tf",
        "jax",
        "rust",
        "coreml",
        "onnx",
        "safetensors",
        "bert",
        "fill-mask",
        "exbert",
        "en",
        "dataset:bookcorpus",
        "dataset:wikipedia",
        "arxiv:1810.04805",
        "license:apache-2.0",
        "endpoints_compatible",
        "deploy:azure",
        "region:us"
      ],
      "summary_short": {
        "zh": "",
        "en": "",
        "es": ""
      },
      "summary_flags": {
        "needs_tri": true,
        "fast_first": true,
        "placeholder": true
      },
      "summary_version": 0,
      "status": "pending",
      "promptHash": "sha256:103bf1cded07197c1a0c664f6dcb115c0d0822e3d00b7dfad50034a8b7a28f29",
      "stats": {
        "downloads_total": 39333188,
        "likes_total": 2557
      },
      "metadata": {
        "license": "N/A",
        "lang": "N/A",
        "categories": {
          "capabilities": [],
          "scenes": [],
          "lifecycle": []
        }
      },
      "created_at": "2026-02-02T03:30:10.021Z",
      "updated_at": "2026-02-02T03:30:10.021Z",
      "repo_id": "google-bert/bert-base-uncased"
    },
    {
      "canonical_id": "huggingface:argmaxinc/whisperkit-coreml",
      "origin_ids": [
        "argmaxinc/whisperkit-coreml"
      ],
      "source": "huggingface",
      "name": "whisperkit-coreml",
      "url": "https://huggingface.co/argmaxinc/whisperkit-coreml",
      "description": "",
      "tags": [
        "whisperkit",
        "coreml",
        "whisper",
        "asr",
        "quantized",
        "automatic-speech-recognition",
        "region:us"
      ],
      "summary_short": {
        "zh": "",
        "en": "",
        "es": ""
      },
      "summary_flags": {
        "needs_tri": true,
        "fast_first": true,
        "placeholder": true
      },
      "summary_version": 0,
      "status": "pending",
      "promptHash": "sha256:7ef9f4826a6431ff4563a615474b7a60a8a63664de6976e4596f3863d9adc46b",
      "stats": {
        "downloads_total": 1765986,
        "likes_total": 158
      },
      "metadata": {
        "license": "N/A",
        "lang": "N/A",
        "categories": {
          "capabilities": [],
          "scenes": [],
          "lifecycle": []
        }
      },
      "created_at": "2026-02-02T03:30:10.021Z",
      "updated_at": "2026-02-02T03:30:10.021Z",
      "repo_id": "argmaxinc/whisperkit-coreml"
    }
  ]
}
