{
  "schema_version": 1,
  "pipeline_version": "v6",
  "run_id": "daily-2025-12-18-20251218030255.-543ebab2",
  "date": "2025-12-18",
  "source": "github",
  "generated_at": "2025-12-18T03:02:55.427Z",
  "stats": {
    "total": 5,
    "qualified": 0,
    "pending": 5,
    "unqualified": 0,
    "passonce": 0,
    "fast_first": 5
  },
  "items": [
    {
      "canonical_id": "github:codecrafters-io/build-your-own-x",
      "origin_ids": [
        "codecrafters-io/build-your-own-x"
      ],
      "source": "github",
      "name": "build-your-own-x",
      "url": "https://github.com/codecrafters-io/build-your-own-x",
      "description": "Master programming by recreating your favorite technologies from scratch.",
      "tags": [
        "awesome-list",
        "free",
        "programming",
        "tutorial-code",
        "tutorial-exercises",
        "tutorials"
      ],
      "summary_short": {
        "zh": "Master programming by recreating your favorite technologies from scratch.",
        "en": "Master programming by recreating your favorite technologies from scratch.",
        "es": ""
      },
      "summary_flags": {
        "needs_tri": true,
        "fast_first": true,
        "placeholder": true
      },
      "summary_version": 0,
      "status": "pending",
      "promptHash": "sha256:f0cc453408c52590c9c95e035339467922e740d334a51760d2024391693233ee",
      "stats": {
        "stars": 449780,
        "forks": 42169,
        "issues": 456
      },
      "metadata": {
        "license": "N/A",
        "lang": "Markdown",
        "categories": {
          "capabilities": [],
          "scenes": [],
          "lifecycle": []
        }
      },
      "created_at": "2025-12-18T03:02:55.427Z",
      "updated_at": "2025-12-18T03:02:55.427Z",
      "owner": "codecrafters-io"
    },
    {
      "canonical_id": "github:freeCodeCamp/freeCodeCamp",
      "origin_ids": [
        "freeCodeCamp/freeCodeCamp"
      ],
      "source": "github",
      "name": "freeCodeCamp",
      "url": "https://github.com/freeCodeCamp/freeCodeCamp",
      "description": "freeCodeCamp.org's open-source codebase and curriculum. Learn math, programming, and computer science for free.",
      "tags": [
        "careers",
        "certification",
        "community",
        "curriculum",
        "d3",
        "education",
        "freecodecamp",
        "javascript",
        "learn-to-code",
        "math",
        "nodejs",
        "nonprofits",
        "programming",
        "react",
        "teachers"
      ],
      "summary_short": {
        "zh": "freeCodeCamp.org's open-source codebase and curriculum. Learn math, programming, and computer science for free.",
        "en": "freeCodeCamp.org's open-source codebase and curriculum. Learn math, programming, and computer science for free.",
        "es": ""
      },
      "summary_flags": {
        "needs_tri": true,
        "fast_first": true,
        "placeholder": true
      },
      "summary_version": 0,
      "status": "pending",
      "promptHash": "sha256:7ce99892d88148e7d5cae0b4fc07936e1c16cb26ec455fb4ce856749a954c941",
      "stats": {
        "stars": 434909,
        "forks": 42846,
        "issues": 304
      },
      "metadata": {
        "license": "BSD-3-Clause",
        "lang": "TypeScript",
        "categories": {
          "capabilities": [],
          "scenes": [],
          "lifecycle": []
        }
      },
      "created_at": "2025-12-18T03:02:55.427Z",
      "updated_at": "2025-12-18T03:02:55.427Z",
      "owner": "freeCodeCamp"
    },
    {
      "canonical_id": "github:sindresorhus/awesome",
      "origin_ids": [
        "sindresorhus/awesome"
      ],
      "source": "github",
      "name": "awesome",
      "url": "https://github.com/sindresorhus/awesome",
      "description": "😎 Awesome lists about all kinds of interesting topics",
      "tags": [
        "awesome",
        "awesome-list",
        "lists",
        "resources",
        "unicorns"
      ],
      "summary_short": {
        "zh": "😎 Awesome lists about all kinds of interesting topics",
        "en": "😎 Awesome lists about all kinds of interesting topics",
        "es": ""
      },
      "summary_flags": {
        "needs_tri": true,
        "fast_first": true,
        "placeholder": true
      },
      "summary_version": 0,
      "status": "pending",
      "promptHash": "sha256:2724fb8aae725474927df4f6b45de69bae28d10fbcf1a45f9da35c228ebe25de",
      "stats": {
        "stars": 423131,
        "forks": 32607,
        "issues": 54
      },
      "metadata": {
        "license": "CC0-1.0",
        "lang": "N/A",
        "categories": {
          "capabilities": [],
          "scenes": [],
          "lifecycle": []
        }
      },
      "created_at": "2025-12-18T03:02:55.427Z",
      "updated_at": "2025-12-18T03:02:55.427Z",
      "owner": "sindresorhus"
    },
    {
      "canonical_id": "github:public-apis/public-apis",
      "origin_ids": [
        "public-apis/public-apis"
      ],
      "source": "github",
      "name": "public-apis",
      "url": "https://github.com/public-apis/public-apis",
      "description": "A collective list of free APIs",
      "tags": [
        "api",
        "apis",
        "dataset",
        "development",
        "free",
        "list",
        "lists",
        "open-source",
        "public",
        "public-api",
        "public-apis",
        "resources",
        "software"
      ],
      "summary_short": {
        "zh": "A collective list of free APIs",
        "en": "A collective list of free APIs",
        "es": ""
      },
      "summary_flags": {
        "needs_tri": true,
        "fast_first": true,
        "placeholder": true
      },
      "summary_version": 0,
      "status": "pending",
      "promptHash": "sha256:2f7e803145c8932a8d3a6af2351a8c66d6db19e0b3d661aba966423d3b32968f",
      "stats": {
        "stars": 386115,
        "forks": 41217,
        "issues": 757
      },
      "metadata": {
        "license": "MIT",
        "lang": "Python",
        "categories": {
          "capabilities": [],
          "scenes": [],
          "lifecycle": []
        }
      },
      "created_at": "2025-12-18T03:02:55.427Z",
      "updated_at": "2025-12-18T03:02:55.427Z",
      "owner": "public-apis"
    },
    {
      "canonical_id": "github:EbookFoundation/free-programming-books",
      "origin_ids": [
        "EbookFoundation/free-programming-books"
      ],
      "source": "github",
      "name": "free-programming-books",
      "url": "https://github.com/EbookFoundation/free-programming-books",
      "description": ":books: Freely available programming books",
      "tags": [
        "books",
        "education",
        "hacktoberfest",
        "list",
        "resource"
      ],
      "summary_short": {
        "zh": ":books: Freely available programming books",
        "en": ":books: Freely available programming books",
        "es": ""
      },
      "summary_flags": {
        "needs_tri": true,
        "fast_first": true,
        "placeholder": true
      },
      "summary_version": 0,
      "status": "pending",
      "promptHash": "sha256:f498b06b6c0acc167c4862603584f4df565b0c479f8ee125ddcb7f6ddcef5d05",
      "stats": {
        "stars": 378969,
        "forks": 65634,
        "issues": 201
      },
      "metadata": {
        "license": "CC-BY-4.0",
        "lang": "Python",
        "categories": {
          "capabilities": [],
          "scenes": [],
          "lifecycle": []
        }
      },
      "created_at": "2025-12-18T03:02:55.427Z",
      "updated_at": "2025-12-18T03:02:55.427Z",
      "owner": "EbookFoundation"
    }
  ]
}
