{
  "schema_version": 1,
  "pipeline_version": "v6",
  "run_id": "daily-2025-11-23-20251123030607.-47541537",
  "date": "2025-11-23",
  "source": "github",
  "generated_at": "2025-11-23T03:06:07.794Z",
  "stats": {
    "total": 5,
    "qualified": 0,
    "pending": 5,
    "unqualified": 0,
    "passonce": 0,
    "fast_first": 5
  },
  "items": [
    {
      "canonical_id": "github:freeCodeCamp/freeCodeCamp",
      "origin_ids": [
        "freeCodeCamp/freeCodeCamp"
      ],
      "source": "github",
      "name": "freeCodeCamp",
      "url": "https://github.com/freeCodeCamp/freeCodeCamp",
      "description": "freeCodeCamp.org's open-source codebase and curriculum. Learn math, programming, and computer science for free.",
      "tags": [
        "careers",
        "certification",
        "community",
        "curriculum",
        "d3",
        "education",
        "freecodecamp",
        "javascript",
        "learn-to-code",
        "math",
        "nodejs",
        "nonprofits",
        "programming",
        "react",
        "teachers"
      ],
      "summary_short": {
        "zh": "freeCodeCamp.org's open-source codebase and curriculum. Learn math, programming, and computer science for free.",
        "en": "freeCodeCamp.org's open-source codebase and curriculum. Learn math, programming, and computer science for free.",
        "es": ""
      },
      "summary_flags": {
        "needs_tri": true,
        "fast_first": true,
        "placeholder": true
      },
      "summary_version": 0,
      "status": "pending",
      "promptHash": "sha256:7ce99892d88148e7d5cae0b4fc07936e1c16cb26ec455fb4ce856749a954c941",
      "stats": {
        "stars": 432905,
        "forks": 42528,
        "issues": 277
      },
      "metadata": {
        "license": "BSD-3-Clause",
        "lang": "TypeScript",
        "categories": {
          "capabilities": [],
          "scenes": [],
          "lifecycle": []
        }
      },
      "created_at": "2025-11-23T03:06:07.794Z",
      "updated_at": "2025-11-23T03:06:07.794Z",
      "owner": "freeCodeCamp"
    },
    {
      "canonical_id": "github:sindresorhus/awesome",
      "origin_ids": [
        "sindresorhus/awesome"
      ],
      "source": "github",
      "name": "awesome",
      "url": "https://github.com/sindresorhus/awesome",
      "description": "😎 Awesome lists about all kinds of interesting topics",
      "tags": [
        "awesome",
        "awesome-list",
        "lists",
        "resources",
        "unicorns"
      ],
      "summary_short": {
        "zh": "😎 Awesome lists about all kinds of interesting topics",
        "en": "😎 Awesome lists about all kinds of interesting topics",
        "es": ""
      },
      "summary_flags": {
        "needs_tri": true,
        "fast_first": true,
        "placeholder": true
      },
      "summary_version": 0,
      "status": "pending",
      "promptHash": "sha256:2724fb8aae725474927df4f6b45de69bae28d10fbcf1a45f9da35c228ebe25de",
      "stats": {
        "stars": 416878,
        "forks": 32352,
        "issues": 49
      },
      "metadata": {
        "license": "CC0-1.0",
        "lang": "N/A",
        "categories": {
          "capabilities": [],
          "scenes": [],
          "lifecycle": []
        }
      },
      "created_at": "2025-11-23T03:06:07.794Z",
      "updated_at": "2025-11-23T03:06:07.794Z",
      "owner": "sindresorhus"
    },
    {
      "canonical_id": "github:public-apis/public-apis",
      "origin_ids": [
        "public-apis/public-apis"
      ],
      "source": "github",
      "name": "public-apis",
      "url": "https://github.com/public-apis/public-apis",
      "description": "A collective list of free APIs",
      "tags": [
        "api",
        "apis",
        "dataset",
        "development",
        "free",
        "list",
        "lists",
        "open-source",
        "public",
        "public-api",
        "public-apis",
        "resources",
        "software"
      ],
      "summary_short": {
        "zh": "A collective list of free APIs",
        "en": "A collective list of free APIs",
        "es": ""
      },
      "summary_flags": {
        "needs_tri": true,
        "fast_first": true,
        "placeholder": true
      },
      "summary_version": 0,
      "status": "pending",
      "promptHash": "sha256:2f7e803145c8932a8d3a6af2351a8c66d6db19e0b3d661aba966423d3b32968f",
      "stats": {
        "stars": 380154,
        "forks": 40368,
        "issues": 702
      },
      "metadata": {
        "license": "MIT",
        "lang": "Python",
        "categories": {
          "capabilities": [],
          "scenes": [],
          "lifecycle": []
        }
      },
      "created_at": "2025-11-23T03:06:07.794Z",
      "updated_at": "2025-11-23T03:06:07.794Z",
      "owner": "public-apis"
    },
    {
      "canonical_id": "github:EbookFoundation/free-programming-books",
      "origin_ids": [
        "EbookFoundation/free-programming-books"
      ],
      "source": "github",
      "name": "free-programming-books",
      "url": "https://github.com/EbookFoundation/free-programming-books",
      "description": ":books: Freely available programming books",
      "tags": [
        "books",
        "education",
        "hacktoberfest",
        "list",
        "resource"
      ],
      "summary_short": {
        "zh": ":books: Freely available programming books",
        "en": ":books: Freely available programming books",
        "es": ""
      },
      "summary_flags": {
        "needs_tri": true,
        "fast_first": true,
        "placeholder": true
      },
      "summary_version": 0,
      "status": "pending",
      "promptHash": "sha256:f498b06b6c0acc167c4862603584f4df565b0c479f8ee125ddcb7f6ddcef5d05",
      "stats": {
        "stars": 377369,
        "forks": 65470,
        "issues": 199
      },
      "metadata": {
        "license": "CC-BY-4.0",
        "lang": "Python",
        "categories": {
          "capabilities": [],
          "scenes": [],
          "lifecycle": []
        }
      },
      "created_at": "2025-11-23T03:06:07.794Z",
      "updated_at": "2025-11-23T03:06:07.794Z",
      "owner": "EbookFoundation"
    },
    {
      "canonical_id": "github:jwasham/coding-interview-university",
      "origin_ids": [
        "jwasham/coding-interview-university"
      ],
      "source": "github",
      "name": "coding-interview-university",
      "url": "https://github.com/jwasham/coding-interview-university",
      "description": "A complete computer science study plan to become a software engineer.",
      "tags": [
        "algorithm",
        "algorithms",
        "coding-interview",
        "coding-interviews",
        "computer-science",
        "data-structures",
        "interview",
        "interview-prep",
        "interview-preparation",
        "programming-interviews",
        "software-engineering",
        "study-plan"
      ],
      "summary_short": {
        "zh": "A complete computer science study plan to become a software engineer.",
        "en": "A complete computer science study plan to become a software engineer.",
        "es": ""
      },
      "summary_flags": {
        "needs_tri": true,
        "fast_first": true,
        "placeholder": true
      },
      "summary_version": 0,
      "status": "pending",
      "promptHash": "sha256:3c6ec9fbea8a96a623f2f38d74b2bd6b437e27ea550dfe100cfa566625f218a3",
      "stats": {
        "stars": 333845,
        "forks": 81294,
        "issues": 88
      },
      "metadata": {
        "license": "CC-BY-SA-4.0",
        "lang": "N/A",
        "categories": {
          "capabilities": [],
          "scenes": [],
          "lifecycle": []
        }
      },
      "created_at": "2025-11-23T03:06:07.794Z",
      "updated_at": "2025-11-23T03:06:07.794Z",
      "owner": "jwasham"
    }
  ]
}
